<?xml version="1.0" encoding="UTF-8"?>
<xsd:schema 
    xmlns:t="http://namespace.profile.com/ns/transcript"
    xmlns:xsd="http://www.w3.org/2001/XMLSchema"
    targetNamespace="http://namespace.profile.com/ns/transcript"
    elementFormDefault="qualified">
    
    <xsd:element name="transcript">
        <xsd:complexType>
            <xsd:sequence>
                <xsd:element name="studentName" type="xsd:string"/>
		<xsd:element name="university" type="xsd:string"/>
                <xsd:element name="program" type="xsd:string"/>
                <xsd:element name="issueDate" type="xsd:date"/>
                <xsd:element name="courses">
                    <xsd:complexType>
                        <xsd:sequence>
                            <xsd:element name="course" minOccurs="1" maxOccurs="unbounded">
                                <xsd:complexType>
                                        <xsd:sequence>
                                                <xsd:element name="code">
                                                        <xsd:simpleType>
                                                        <xsd:restriction base="xsd:string">
                                                                <xsd:pattern value="[A-Z][A-Z][0-9][0-9][0-9][0-9]"/>
                                                        </xsd:restriction>
                                                        </xsd:simpleType>
                                                </xsd:element>	
                                                <xsd:element name="title" type="xsd:string" />
                                                <xsd:element name="credits" type="xsd:decimal" />
                                                <xsd:element name="grade" type="xsd:string" />
                                        </xsd:sequence>
                                </xsd:complexType>
                            </xsd:element>
                        </xsd:sequence>
                    </xsd:complexType>
                </xsd:element>               
            </xsd:sequence>
        </xsd:complexType>
    </xsd:element>
    
</xsd:schema>
