<?xml version="1.0" encoding="UTF-8"?>
<t:transcript
    xmlns:xsi='http://www.w3.org/2001/XMLSchema-instance'
    xmlns:t='http://namespace.profile.com/ns/transcript'
    xsi:schemaLocation='http://namespace.profile.com/ns/transcript transcript.xsd'>
    <t:studentName>Annabelle White</t:studentName>
    <t:university>KTH</t:university>
    <t:program>Masters Software Engineering of Distributed Systems</t:program>
    <t:issueDate>2012-12-23</t:issueDate>
    <t:courses>
        <t:course>
            <t:code>IK2210</t:code>
            <t:title>Distributed Systems, Basic Course</t:title>
            <t:credits>7.5</t:credits>
            <t:grade>A</t:grade>
        </t:course>
        <t:course>
            <t:code>IB2210</t:code>
            <t:title>Modern Methods in Software Engineering</t:title>
            <t:credits>7.5</t:credits>
            <t:grade>B</t:grade>
        </t:course>
        <t:course>
            <t:code>IB2210</t:code>
            <t:title>Distributed Artificial Intelligence and Intelligent Agents</t:title>
            <t:credits>7.5</t:credits>
            <t:grade>A</t:grade>
        </t:course>
        <t:course>
            <t:code>ID1234</t:code>
            <t:title>Network Programming in Java</t:title>
            <t:credits>6</t:credits>
            <t:grade>B</t:grade>
        </t:course>
    </t:courses>

</t:transcript>
